<?xml version="1.0" encoding="UTF-8"?>
<AdaptiveChannelsConfig xmlns:xsi="http://www.w3.org/2001/XMLSchema-instance" xsi:noNamespaceSchemaLocation="TSConfig.xsd">
    <TSInfo>
        <TSHost>TeamSpeak Hostname</TSHost>
        <LoginInfo>
            <Username>Admin Username</Username>
            <Password>Admin Password</Password>
        </LoginInfo>
        <BotNickname>Name of the Bot</BotNickname>
        <TSPort>1234</TSPort>
    </TSInfo>
    <ChannelInfo>
        <Channel ChannelName="Channel 1">
            <ParentChannelID>10</ParentChannelID>
            <MainChannelID>43</MainChannelID>
        </Channel>
        <Channel ChannelName="Channel 2">
            <ParentChannelID>10</ParentChannelID>
            <MainChannelID>891</MainChannelID>
        </Channel>
    </ChannelInfo>
    <Spacer>
        <Top>┏</Top>
        <Middle>┣</Middle>
        <Bottom>┗</Bottom>
    </Spacer>
</AdaptiveChannelsConfig>
